,title,id,arxiv_url,published
0,Empowering GraphRAG with Knowledge Filtering and Integration,2503.13804,http://arxiv.org/abs/2503.13804v1,2025-03-18 01:29:55+00:00
1,MDTeamGPT: A Self-Evolving LLM-based Multi-Agent Framework for Multi-Disciplinary Team Medical Consultation,2503.13856,http://arxiv.org/abs/2503.13856v1,2025-03-18 03:07:34+00:00
2,Bridging Social Psychology and LLM Reasoning: Conflict-Aware Meta-Review Generation via Cognitive Alignment,2503.13879,http://arxiv.org/abs/2503.13879v2,2025-03-18 04:13:11+00:00
3,EIAD: Explainable Industrial Anomaly Detection Via Multi-Modal Large Language Models,2503.14162,http://arxiv.org/abs/2503.14162v1,2025-03-18 11:33:29+00:00
4,Inferring Event Descriptions from Time Series with Language Models,2503.14190,http://arxiv.org/abs/2503.14190v1,2025-03-18 12:07:33+00:00
5,Driving behavior recognition via self-discovery learning,2503.14194,http://arxiv.org/abs/2503.14194v1,2025-03-18 12:13:08+00:00
6,A Parallel Hybrid Action Space Reinforcement Learning Model for Real-world Adaptive Traffic Signal Control,2503.14250,http://arxiv.org/abs/2503.14250v1,2025-03-18 13:38:53+00:00
7,VisEscape: A Benchmark for Evaluating Exploration-driven Decision-making in Virtual Escape Rooms,2503.14427,http://arxiv.org/abs/2503.14427v2,2025-03-18 16:59:09+00:00
8,Mapping the Trust Terrain: LLMs in Software Engineering -- Insights and Perspectives,2503.13793,http://arxiv.org/abs/2503.13793v1,2025-03-18 00:49:43+00:00
9,LED: LLM Enhanced Open-Vocabulary Object Detection without Human Curated Data Generation,2503.13794,http://arxiv.org/abs/2503.13794v1,2025-03-18 00:50:40+00:00
10,AI-Powered Prediction of Nanoparticle Pharmacokinetics: A Multi-View Learning Approach,2503.13798,http://arxiv.org/abs/2503.13798v1,2025-03-18 01:09:32+00:00
11,SMILE: a Scale-aware Multiple Instance Learning Method for Multicenter STAS Lung Cancer Histopathology Diagnosis,2503.13799,http://arxiv.org/abs/2503.13799v1,2025-03-18 01:09:52+00:00
12,Organ-aware Multi-scale Medical Image Segmentation Using Text Prompt Engineering,2503.13806,http://arxiv.org/abs/2503.13806v1,2025-03-18 01:35:34+00:00
13,The Empty Chair: Using LLMs to Raise Missing Perspectives in Policy Deliberations,2503.13812,http://arxiv.org/abs/2503.13812v1,2025-03-18 01:45:08+00:00
14,Automatic MILP Model Construction for Multi-Robot Task Allocation and Scheduling Based on Large Language Models,2503.13813,http://arxiv.org/abs/2503.13813v1,2025-03-18 01:45:19+00:00
15,WebNav: An Intelligent Agent for Voice-Controlled Web Navigation,2503.13843,http://arxiv.org/abs/2503.13843v1,2025-03-18 02:33:27+00:00
16,Disentangling Fine-Tuning from Pre-Training in Visual Captioning with Hybrid Markov Logic,2503.13847,http://arxiv.org/abs/2503.13847v1,2025-03-18 02:39:26+00:00
17,RAD: Retrieval-Augmented Decision-Making of Meta-Actions with Vision-Language Models in Autonomous Driving,2503.13861,http://arxiv.org/abs/2503.13861v1,2025-03-18 03:25:57+00:00
18,Out-of-Distribution Generalization in Time Series: A Survey,2503.13868,http://arxiv.org/abs/2503.13868v1,2025-03-18 03:35:29+00:00
19,MoK-RAG: Mixture of Knowledge Paths Enhanced Retrieval-Augmented Generation for Embodied AI Environments,2503.13882,http://arxiv.org/abs/2503.13882v1,2025-03-18 04:27:02+00:00
20,TGBFormer: Transformer-GraphFormer Blender Network for Video Object Detection,2503.13903,http://arxiv.org/abs/2503.13903v1,2025-03-18 05:03:05+00:00
21,HSOD-BIT-V2: A New Challenging Benchmarkfor Hyperspectral Salient Object Detection,2503.13906,http://arxiv.org/abs/2503.13906v1,2025-03-18 05:09:42+00:00
22,Unlocking the Potential of Unlabeled Data in Semi-Supervised Domain Generalization,2503.13915,http://arxiv.org/abs/2503.13915v1,2025-03-18 05:19:33+00:00
23,Learning Bimanual Manipulation via Action Chunking and Inter-Arm Coordination with Transformers,2503.13916,http://arxiv.org/abs/2503.13916v1,2025-03-18 05:20:34+00:00
24,Learning Accurate Models on Incomplete Data with Minimal Imputation,2503.13921,http://arxiv.org/abs/2503.13921v1,2025-03-18 05:36:59+00:00
25,ConSCompF: Consistency-focused Similarity Comparison Framework for Generative Large Language Models,2503.13923,http://arxiv.org/abs/2503.13923v1,2025-03-18 05:38:04+00:00
26,COLSON: Controllable Learning-Based Social Navigation via Diffusion-Based Reinforcement Learning,2503.13934,http://arxiv.org/abs/2503.13934v1,2025-03-18 06:02:30+00:00
27,ChatBEV: A Visual Language Model that Understands BEV Maps,2503.13938,http://arxiv.org/abs/2503.13938v2,2025-03-18 06:12:38+00:00
28,FrustumFusionNets: A Three-Dimensional Object Detection Network Based on Tractor Road Scene,2503.13951,http://arxiv.org/abs/2503.13951v1,2025-03-18 06:40:39+00:00
29,Empowering Smaller Models: Tuning LLaMA and Gemma with Chain-of-Thought for Ukrainian Exam Tasks,2503.13988,http://arxiv.org/abs/2503.13988v1,2025-03-18 07:44:49+00:00
30,GraphTEN: Graph Enhanced Texture Encoding Network,2503.13991,http://arxiv.org/abs/2503.13991v1,2025-03-18 07:51:13+00:00
31,BI-RADS prediction of mammographic masses using uncertainty information extracted from a Bayesian Deep Learning model,2503.13999,http://arxiv.org/abs/2503.13999v1,2025-03-18 08:06:05+00:00
32,Boosting Semi-Supervised Medical Image Segmentation via Masked Image Consistency and Discrepancy Learning,2503.14013,http://arxiv.org/abs/2503.14013v1,2025-03-18 08:20:35+00:00
33,Fast Autoregressive Video Generation with Diagonal Decoding,2503.14070,http://arxiv.org/abs/2503.14070v1,2025-03-18 09:42:55+00:00
34,"Theoretical Foundation of Flow-Based Time Series Generation: Provable Approximation, Generalization, and Efficiency",2503.14076,http://arxiv.org/abs/2503.14076v1,2025-03-18 09:53:48+00:00
35,Toward Large-Scale Distributed Quantum Long Short-Term Memory with Modular Quantum Computers,2503.14088,http://arxiv.org/abs/2503.14088v1,2025-03-18 10:07:34+00:00
36,Operational Change Detection for Geographical Information: Overview and Challenges,2503.14109,http://arxiv.org/abs/2503.14109v1,2025-03-18 10:25:28+00:00
37,Inference-Time Intervention in Large Language Models for Reliable Requirement Verification,2503.14130,http://arxiv.org/abs/2503.14130v1,2025-03-18 10:49:36+00:00
38,CARE: A QLoRA-Fine Tuned Multi-Domain Chatbot With Fast Learning On Minimal Hardware,2503.14136,http://arxiv.org/abs/2503.14136v1,2025-03-18 10:58:10+00:00
39,Concat-ID: Towards Universal Identity-Preserving Video Synthesis,2503.14151,http://arxiv.org/abs/2503.14151v1,2025-03-18 11:17:32+00:00
40,Stochastic Trajectory Prediction under Unstructured Constraints,2503.14203,http://arxiv.org/abs/2503.14203v1,2025-03-18 12:27:59+00:00
41,Panoramic Distortion-Aware Tokenization for Person Detection and Localization Using Transformers in Overhead Fisheye Images,2503.14228,http://arxiv.org/abs/2503.14228v1,2025-03-18 13:05:41+00:00
42,KG-IRAG: A Knowledge Graph-Based Iterative Retrieval-Augmented Generation Framework for Temporal Reasoning,2503.14234,http://arxiv.org/abs/2503.14234v2,2025-03-18 13:11:43+00:00
43,Trading-off Accuracy and Communication Cost in Federated Learning,2503.14246,http://arxiv.org/abs/2503.14246v1,2025-03-18 13:35:24+00:00
44,GeoFlow-SLAM: A Robust Tightly-Coupled RGBD-Inertial Fusion SLAM for Dynamic Legged Robotics,2503.14247,http://arxiv.org/abs/2503.14247v1,2025-03-18 13:35:49+00:00
45,CTSAC: Curriculum-Based Transformer Soft Actor-Critic for Goal-Oriented Robot Exploration,2503.14254,http://arxiv.org/abs/2503.14254v1,2025-03-18 13:44:29+00:00
46,Manual Labelling Artificially Inflates Deep Learning-Based Segmentation Performance on RGB Images of Closed Canopy: Validation Using TLS,2503.14273,http://arxiv.org/abs/2503.14273v2,2025-03-18 14:09:00+00:00
47,Ensemble Knowledge Distillation for Machine Learning Interatomic Potentials,2503.14293,http://arxiv.org/abs/2503.14293v2,2025-03-18 14:32:51+00:00
48,PC-Talk: Precise Facial Animation Control for Audio-Driven Talking Face Generation,2503.14295,http://arxiv.org/abs/2503.14295v2,2025-03-18 14:35:48+00:00
49,COPA: Comparing the Incomparable to Explore the Pareto Front,2503.14321,http://arxiv.org/abs/2503.14321v1,2025-03-18 14:51:42+00:00
50,Spatio-Temporal Graph Neural Networks for Infant Language Acquisition Prediction,2503.14341,http://arxiv.org/abs/2503.14341v1,2025-03-18 15:21:27+00:00
51,Tiled Flash Linear Attention: More Efficient Linear RNN and xLSTM Kernels,2503.14376,http://arxiv.org/abs/2503.14376v1,2025-03-18 16:09:47+00:00
52,Unifying Text Semantics and Graph Structures for Temporal Text-attributed Graphs with Large Language Models,2503.14411,http://arxiv.org/abs/2503.14411v1,2025-03-18 16:50:10+00:00
53,Iffy-Or-Not: Extending the Web to Support the Critical Evaluation of Fallacious Texts,2503.14412,http://arxiv.org/abs/2503.14412v1,2025-03-18 16:50:20+00:00
54,MagicComp: Training-free Dual-Phase Refinement for Compositional Video Generation,2503.14428,http://arxiv.org/abs/2503.14428v1,2025-03-18 17:02:14+00:00
55,Pauli Network Circuit Synthesis with Reinforcement Learning,2503.14448,http://arxiv.org/abs/2503.14448v1,2025-03-18 17:27:50+00:00
56,Attribution Score Alignment in Explainable Data Management,2503.14469,http://arxiv.org/abs/2503.14469v1,2025-03-18 17:45:32+00:00
57,DiffMoE: Dynamic Token Selection for Scalable Diffusion Transformers,2503.14487,http://arxiv.org/abs/2503.14487v1,2025-03-18 17:57:07+00:00
58,Engineering Scientific Assistants using Interactive Structured Induction of Programs,2503.14488,http://arxiv.org/abs/2503.14488v1,2025-03-18 17:57:16+00:00
59,State Space Model Meets Transformer: A New Paradigm for 3D Object Detection,2503.14493,http://arxiv.org/abs/2503.14493v2,2025-03-18 17:58:03+00:00
60,Measuring AI Ability to Complete Long Tasks,2503.14499,http://arxiv.org/abs/2503.14499v1,2025-03-18 17:59:31+00:00
61,Designing and Deploying AI Models for Sustainable Logistics Optimization: A Case Study on Eco-Efficient Supply Chains in the USA,2503.14556,http://arxiv.org/abs/2503.14556v1,2025-03-18 00:46:35+00:00
62,Workflow for Safe-AI,2503.14563,http://arxiv.org/abs/2503.14563v2,2025-03-18 07:45:18+00:00
63,Potential Score Matching: Debiasing Molecular Structure Sampling with Potential Energy Guidance,2503.14569,http://arxiv.org/abs/2503.14569v1,2025-03-18 11:27:28+00:00
64,Robust Weight Imprinting: Insights from Neural Collapse and Proxy-Based Aggregation,2503.14572,http://arxiv.org/abs/2503.14572v1,2025-03-18 14:27:45+00:00
65,SocialJax: An Evaluation Suite for Multi-agent Reinforcement Learning in Sequential Social Dilemmas,2503.14576,http://arxiv.org/abs/2503.14576v1,2025-03-18 16:03:59+00:00
66,PHGNN: A Novel Prompted Hypergraph Neural Network to Diagnose Alzheimer's Disease,2503.14577,http://arxiv.org/abs/2503.14577v1,2025-03-18 16:10:43+00:00
67,Reducing False Ventricular Tachycardia Alarms in ICU Settings: A Machine Learning Approach,2503.14621,http://arxiv.org/abs/2503.14621v1,2025-03-18 18:18:38+00:00
68,Dynamic Accumulated Attention Map for Interpreting Evolution of Decision-Making in Vision Transformer,2503.14640,http://arxiv.org/abs/2503.14640v1,2025-03-18 18:41:01+00:00
69,ConQuer: A Framework for Concept-Based Quiz Generation,2503.14662,http://arxiv.org/abs/2503.14662v1,2025-03-18 19:10:26+00:00
70,DPImageBench: A Unified Benchmark for Differentially Private Image Synthesis,2503.14681,http://arxiv.org/abs/2503.14681v1,2025-03-18 19:37:35+00:00
71,Construction Site Scaffolding Completeness Detection Based on Mask R-CNN and Hough Transform,2503.14716,http://arxiv.org/abs/2503.14716v1,2025-03-18 20:27:22+00:00
72,Language Independent Named Entity Recognition via Orthogonal Transformation of Word Vectors,2503.14755,http://arxiv.org/abs/2503.14755v1,2025-03-18 21:57:58+00:00
73,Zero-Knowledge Federated Learning: A New Trustworthy and Privacy-Preserving Distributed Learning Paradigm,2503.15550,http://arxiv.org/abs/2503.15550v1,2025-03-18 06:21:08+00:00
74,Whole-Body Image-to-Image Translation for a Virtual Scanner in a Healthcare Digital Twin,2503.15555,http://arxiv.org/abs/2503.15555v1,2025-03-18 20:19:28+00:00
75,HDLCoRe: A Training-Free Framework for Mitigating Hallucinations in LLM-Generated HDL,2503.16528,http://arxiv.org/abs/2503.16528v1,2025-03-18 07:09:39+00:00
76,"Modelling Emotions in Face-to-Face Setting: The Interplay of Eye-Tracking, Personality, and Temporal Dynamics",2503.16532,http://arxiv.org/abs/2503.16532v1,2025-03-18 13:15:32+00:00
77,From Patient Consultations to Graphs: Leveraging LLMs for Patient Journey Knowledge Graph Construction,2503.16533,http://arxiv.org/abs/2503.16533v1,2025-03-18 14:44:28+00:00
78,Evaluating the Application of SOLID Principles in Modern AI Framework Architectures,2503.13786,http://arxiv.org/abs/2503.13786v1,2025-03-18 00:37:23+00:00
79,VARP: Reinforcement Learning from Vision-Language Model Feedback with Agent Regularized Preferences,2503.13817,http://arxiv.org/abs/2503.13817v1,2025-03-18 01:51:27+00:00
80,SALAD: Skeleton-aware Latent Diffusion for Text-driven Motion Generation and Editing,2503.13836,http://arxiv.org/abs/2503.13836v1,2025-03-18 02:20:11+00:00
81,Counterfactual experience augmented off-policy reinforcement learning,2503.13842,http://arxiv.org/abs/2503.13842v1,2025-03-18 02:32:50+00:00
82,Spotting Persuasion: A Low-cost Model for Persuasion Detection in Political Ads on Social Media,2503.13844,http://arxiv.org/abs/2503.13844v1,2025-03-18 02:33:38+00:00
83,KANITE: Kolmogorov-Arnold Networks for ITE estimation,2503.13912,http://arxiv.org/abs/2503.13912v1,2025-03-18 05:16:36+00:00
84,DefectFill: Realistic Defect Generation with Inpainting Diffusion Model for Visual Inspection,2503.13985,http://arxiv.org/abs/2503.13985v1,2025-03-18 07:42:11+00:00
85,MeshFleet: Filtered and Annotated 3D Vehicle Dataset for Domain Specific Generative Modeling,2503.14002,http://arxiv.org/abs/2503.14002v1,2025-03-18 08:09:24+00:00
86,MP-GUI: Modality Perception with MLLMs for GUI Understanding,2503.14021,http://arxiv.org/abs/2503.14021v1,2025-03-18 08:32:22+00:00
87,ON-Traffic: An Operator Learning Framework for Online Traffic Flow Estimation and Uncertainty Quantification from Lagrangian Sensors,2503.14053,http://arxiv.org/abs/2503.14053v1,2025-03-18 09:13:24+00:00
88,Sensory-driven microinterventions for improved health and wellbeing,2503.14102,http://arxiv.org/abs/2503.14102v1,2025-03-18 10:17:55+00:00
89,Reliable uncertainty quantification for 2D/3D anatomical landmark localization using multi-output conformal prediction,2503.14106,http://arxiv.org/abs/2503.14106v1,2025-03-18 10:21:32+00:00
90,Frac-Connections: Fractional Extension of Hyper-Connections,2503.14125,http://arxiv.org/abs/2503.14125v1,2025-03-18 10:37:50+00:00
91,"Exploring Disparity-Accuracy Trade-offs in Face Recognition Systems: The Role of Datasets, Architectures, and Loss Functions",2503.14138,http://arxiv.org/abs/2503.14138v1,2025-03-18 11:04:57+00:00
92,Can LLMs Enable Verification in Mainstream Programming?,2503.14183,http://arxiv.org/abs/2503.14183v1,2025-03-18 11:58:00+00:00
93,Variable Time-Step MPC for Agile Multi-Rotor UAV Interception of Dynamic Targets,2503.14184,http://arxiv.org/abs/2503.14184v1,2025-03-18 11:59:24+00:00
94,"HA-VLN: A Benchmark for Human-Aware Navigation in Discrete-Continuous Environments with Dynamic Multi-Human Interactions, Real-World Validation, and an Open Leaderboard",2503.14229,http://arxiv.org/abs/2503.14229v1,2025-03-18 13:05:55+00:00
95,CRCE: Coreference-Retention Concept Erasure in Text-to-Image Diffusion Models,2503.14232,http://arxiv.org/abs/2503.14232v1,2025-03-18 13:09:01+00:00
96,JuDGE: Benchmarking Judgment Document Generation for Chinese Legal System,2503.14258,http://arxiv.org/abs/2503.14258v2,2025-03-18 13:48:18+00:00
97,Revealing higher-order neural representations with generative artificial intelligence,2503.14333,http://arxiv.org/abs/2503.14333v1,2025-03-18 15:08:19+00:00
98,VEGGIE: Instructional Editing and Reasoning of Video Concepts with Grounded Generation,2503.14350,http://arxiv.org/abs/2503.14350v2,2025-03-18 15:31:12+00:00
99,PLAY2PROMPT: Zero-shot Tool Instruction Optimization for LLM Agents via Tool Play,2503.14432,http://arxiv.org/abs/2503.14432v1,2025-03-18 17:09:57+00:00
