,title,id,arxiv_url,published
0,A decompositional framework for process theories in spacetime,2411.08266,http://arxiv.org/abs/2411.08266v1,2024-11-13 00:37:55+00:00
1,10 GHz Robust polarization modulation towards high-speed satellite-based quantum communication,2411.08358,http://arxiv.org/abs/2411.08358v1,2024-11-13 06:15:24+00:00
2,Quantum partial coherence measures constructed from Fisher information,2411.08368,http://arxiv.org/abs/2411.08368v1,2024-11-13 06:36:58+00:00
3,Advances in quantum imaging,2411.08415,http://arxiv.org/abs/2411.08415v1,2024-11-13 08:07:54+00:00
4,A fiber array architecture for atom quantum computing,2411.08502,http://arxiv.org/abs/2411.08502v1,2024-11-13 10:39:41+00:00
5,Quantum Time Travel Revisited: Noncommutative Möbius Transformations and Time Loops,2411.08543,http://arxiv.org/abs/2411.08543v1,2024-11-13 11:43:08+00:00
6,Uncertainty Relations Relative to Phase Space Quantum Reference Frames,2411.08589,http://arxiv.org/abs/2411.08589v1,2024-11-13 13:13:03+00:00
7,Encodings of the weighted MAX k-CUT on qubit systems,2411.08594,http://arxiv.org/abs/2411.08594v2,2024-11-13 13:21:35+00:00
8,"Expressibility, entangling power and quantum average causal effect for causally indefinite circuits",2411.08609,http://arxiv.org/abs/2411.08609v1,2024-11-13 13:53:02+00:00
9,Quantum Measurement Induced Radiative Processes in Continuously Monitored Optical Environments,2411.08689,http://arxiv.org/abs/2411.08689v1,2024-11-13 15:24:57+00:00
10,Shortwave DPS-QKD Employing a SiN Micro-Ring Resonator as Compact Quantum State Analyser,2411.08721,http://arxiv.org/abs/2411.08721v1,2024-11-13 16:04:52+00:00
11,Reducing QAOA Circuit Depth by Factoring out Semi-Symmetries,2411.08824,http://arxiv.org/abs/2411.08824v1,2024-11-13 18:04:01+00:00
12,A Classical Analogue of Entanglement for a Kicked Top,2411.08857,http://arxiv.org/abs/2411.08857v1,2024-11-13 18:38:12+00:00
13,Equivalence between the second order steady state for spin-Boson model and its quantum mean force Gibbs state,2411.08869,http://arxiv.org/abs/2411.08869v1,2024-11-13 18:49:53+00:00
14,Quantum cryptography beyond key distribution: theory and experiment,2411.08877,http://arxiv.org/abs/2411.08877v1,2024-11-13 18:54:19+00:00
15,Unexpected consequences of Post-Quantum theories in the graph-theoretical approach to correlations,2411.09036,http://arxiv.org/abs/2411.09036v1,2024-11-13 21:29:13+00:00
16,Localized states in monitored quantum walks,2411.09044,http://arxiv.org/abs/2411.09044v1,2024-11-13 21:52:10+00:00
17,Real-time measurement error mitigation for one-way quantum computation,2411.09084,http://arxiv.org/abs/2411.09084v1,2024-11-13 23:27:47+00:00
18,"Extending Quantum Perceptrons: Rydberg Devices, Multi-Class Classification, and Error Tolerance",2411.09093,http://arxiv.org/abs/2411.09093v1,2024-11-13 23:56:20+00:00
19,Microscopic Theory of Polariton Group Velocity Renormalization,2411.08288,http://arxiv.org/abs/2411.08288v1,2024-11-13 02:11:13+00:00
20,Non-Hermitian Effects in Dicke models,2411.08365,http://arxiv.org/abs/2411.08365v1,2024-11-13 06:30:10+00:00
21,One-Sided Device-Independent Random Number Generation Through Fiber Channels,2411.08441,http://arxiv.org/abs/2411.08441v1,2024-11-13 08:51:32+00:00
22,Multiplexed bi-layered realization of fault-tolerant quantum computation over optically networked trapped-ion modules,2411.08616,http://arxiv.org/abs/2411.08616v1,2024-11-13 14:04:52+00:00
23,RSFQ All-Digital Programmable Multi-Tone Generator For Quantum Applications,2411.08670,http://arxiv.org/abs/2411.08670v1,2024-11-13 15:03:28+00:00
24,Tolerant Testing of Stabilizer States with Mixed State Inputs,2411.08765,http://arxiv.org/abs/2411.08765v1,2024-11-13 16:51:03+00:00
25,Typical Positivity of Nonequilibrium Entropy Production for Pure States,2411.08850,http://arxiv.org/abs/2411.08850v1,2024-11-13 18:30:23+00:00
26,Ultrafast pump-probe phase-randomized tomography,2411.08855,http://arxiv.org/abs/2411.08855v1,2024-11-13 18:37:30+00:00
27,How NOT to Fool the Masses When Giving Performance Results for Quantum Computers,2411.08860,http://arxiv.org/abs/2411.08860v1,2024-11-13 18:41:22+00:00
28,Emerging Non-Hermitian Topology in a Chiral Driven-Dissipative Bose-Hubbard Model,2411.08965,http://arxiv.org/abs/2411.08965v1,2024-11-13 19:00:34+00:00
29,"Use of Electron Paramagnetic resonance (EPR) technique to build quantum computers: n-qubit (n=1,2,3,4) Toffoli Gates",2411.09010,http://arxiv.org/abs/2411.09010v1,2024-11-13 20:30:47+00:00
30,Precision bounds for multiple currents in open quantum systems,2411.09088,http://arxiv.org/abs/2411.09088v1,2024-11-13 23:38:24+00:00
31,"Embedded structure in quantum theory, functional operator and multiverse",2411.08276,http://arxiv.org/abs/2411.08276v1,2024-11-13 01:24:22+00:00
32,Proposal for a Bell Test with Entangled Atoms of Different Mass,2411.08356,http://arxiv.org/abs/2411.08356v1,2024-11-13 06:00:01+00:00
33,A Simple Model of Superconductors: Insights from Free Fermion and Boson Gases,2411.08391,http://arxiv.org/abs/2411.08391v1,2024-11-13 07:24:07+00:00
34,Making Silicon Emit Light Using Third Harmonic Generation,2411.08442,http://arxiv.org/abs/2411.08442v1,2024-11-13 08:55:24+00:00
35,Conditional expectations in Quantum Mechanics and causal interpretations: the Bohm momentum as a best predictor,2411.08532,http://arxiv.org/abs/2411.08532v1,2024-11-13 11:26:15+00:00
36,Leveraging Pre-Trained Neural Networks to Enhance Machine Learning with Variational Quantum Circuits,2411.08552,http://arxiv.org/abs/2411.08552v1,2024-11-13 12:03:39+00:00
37,Space-local memory in generalized master equations: Reaching the thermodynamic limit for the cost of a small lattice simulation,2411.08598,http://arxiv.org/abs/2411.08598v1,2024-11-13 13:30:03+00:00
38,Optimizing state transfer in a three-qubit array via quantum brachistochrone method,2411.08644,http://arxiv.org/abs/2411.08644v1,2024-11-13 14:35:25+00:00
39,Topological phase transitions in a constrained two-qubit quantum control landscape,2411.08736,http://arxiv.org/abs/2411.08736v1,2024-11-13 16:18:41+00:00
40,Unified analysis of non-Markovian open quantum systems in Gaussian environment using superoperator formalism,2411.08741,http://arxiv.org/abs/2411.08741v1,2024-11-13 16:19:32+00:00
41,Quantum Gas Microscopy of Fermions in the Continuum,2411.08776,http://arxiv.org/abs/2411.08776v1,2024-11-13 17:00:02+00:00
42,In situ imaging of the thermal de Broglie wavelength in an ultracold Bose gas,2411.08779,http://arxiv.org/abs/2411.08779v1,2024-11-13 17:05:41+00:00
43,Measuring pair correlations in Bose and Fermi gases via atom-resolved microscopy,2411.08780,http://arxiv.org/abs/2411.08780v1,2024-11-13 17:05:44+00:00
44,Trapped-ion laser cooling in structured light fields,2411.08844,http://arxiv.org/abs/2411.08844v2,2024-11-13 18:22:04+00:00
45,Thermal Pseudo-Entropy,2411.08948,http://arxiv.org/abs/2411.08948v1,2024-11-13 19:00:00+00:00
46,Many-Body Photon Blockade and Quantum Light Generation from Cavity Quantum Materials,2411.08964,http://arxiv.org/abs/2411.08964v1,2024-11-13 19:00:25+00:00
47,An Implementation of the Finite Element Method in Hybrid Classical/Quantum Computers,2411.09038,http://arxiv.org/abs/2411.09038v1,2024-11-13 21:32:30+00:00
48,Hidden nonlinear optical susceptibilities in linear polaritonic spectra,2411.09039,http://arxiv.org/abs/2411.09039v2,2024-11-13 21:44:10+00:00
49,Fermion-qubit fault-tolerant quantum computing,2411.08955,http://arxiv.org/abs/2411.08955v1,2024-11-13 19:00:02+00:00
50,Critical states exhibit invariance in both position and momentum spaces,2411.09067,http://arxiv.org/abs/2411.09067v1,2024-11-13 22:48:38+00:00
