,title,id,arxiv_url,published
0,Qudit vs. Qubit: Simulated performance of error correction codes in higher dimensions,2502.05992,http://arxiv.org/abs/2502.05992v1,2025-02-09 18:47:50+00:00
1,Perfect Transfer of Entanglement and One-Way Quantum Steering via Parametric Frequency Converter in a Two-mode Cavity Magnomechanical System,2502.06040,http://arxiv.org/abs/2502.06040v1,2025-02-09 21:34:58+00:00
2,Compressed sensing enabled high-bandwidth and large dynamic range magnetic sensing,2502.06070,http://arxiv.org/abs/2502.06070v1,2025-02-09 23:27:22+00:00
3,What Bohmian mechanic says about arrival times of 1D vacuum squeezed states,2502.05734,http://arxiv.org/abs/2502.05734v1,2025-02-09 00:58:00+00:00
4,Mixed Quantum-Classical Dynamics Yields Anharmonic Rabi Oscillations,2502.05767,http://arxiv.org/abs/2502.05767v1,2025-02-09 04:00:45+00:00
5,Simplicial effects and weakly associative partial groups,2502.05958,http://arxiv.org/abs/2502.05958v1,2025-02-09 16:55:01+00:00
6,Detection of Physiological Data Tampering Attacks with Quantum Machine Learning,2502.05966,http://arxiv.org/abs/2502.05966v1,2025-02-09 17:26:41+00:00
7,Explicit Solution Equation for Every Combinatorial Problem via Tensor Networks: MeLoCoToN,2502.05981,http://arxiv.org/abs/2502.05981v1,2025-02-09 18:16:53+00:00
8,Temporal Model On Quantum Logic,2502.07817,http://arxiv.org/abs/2502.07817v1,2025-02-09 17:16:53+00:00
