,title,id,arxiv_url,published
0,Rovibrational structure and electric dipole moments of the AcOCH$_3$+ ion,2605.15121,http://arxiv.org/abs/2605.15121v1,2026-05-14 17:32:42+00:00
1,Transient dynamics of parametric driving for single-electron image current detection in a Paul trap,2605.15087,http://arxiv.org/abs/2605.15087v1,2026-05-14 17:08:33+00:00
2,Deforming the Trail: Baseline Quantum Circuitry for $\text{SU(2)}_k$ Lattice Gauge Theory,2605.15076,http://arxiv.org/abs/2605.15076v1,2026-05-14 17:01:35+00:00
3,"Excitation Flow, Positivity, and Fisher Information for Open Subsystems of an $N$-Qubit Network",2605.15036,http://arxiv.org/abs/2605.15036v1,2026-05-14 16:30:48+00:00
4,Efficient ultrafast homodyne detection of quantum light,2605.14858,http://arxiv.org/abs/2605.14858v1,2026-05-14 14:05:13+00:00
5,Quantum optical synthesis of high-dimensional ultrafast frequency-bin qudits,2605.14314,http://arxiv.org/abs/2605.14314v1,2026-05-14 03:24:08+00:00
6,Imaginarity Resource Theory of Gaussian Quantum Channels,2605.14299,http://arxiv.org/abs/2605.14299v1,2026-05-14 03:05:12+00:00
7,Singular Asymptotics of SPADE in Quantum Source Discrimination,2605.14432,http://arxiv.org/abs/2605.14432v1,2026-05-14 06:26:41+00:00
8,Adaptive Window Decoding based on Spatiotemporal Complementary Gap,2605.14637,http://arxiv.org/abs/2605.14637v1,2026-05-14 09:51:22+00:00
9,Fire and ice: Partially fault-tolerant quantum computing with selective state filtering,2605.15344,http://arxiv.org/abs/2605.15344v1,2026-05-14 19:13:25+00:00
10,How Much Can Gravitons Be Squeezed?,2605.14797,http://arxiv.org/abs/2605.14797v1,2026-05-14 13:07:02+00:00
11,Interference visibility as a witness of preparation contextuality via overlap inequalities,2605.14395,http://arxiv.org/abs/2605.14395v2,2026-05-14 05:20:24+00:00
12,Orthogonal Polynomials and the MacWilliams Transform for Permutation-Invariant Qudit Codes,2605.15372,http://arxiv.org/abs/2605.15372v1,2026-05-14 19:58:50+00:00
13,New approaches to almost i.i.d. information theory,2605.15114,http://arxiv.org/abs/2605.15114v1,2026-05-14 17:27:47+00:00
14,Diagonal Adaptive Non-local Observables on Quantum Neural Networks,2605.15410,http://arxiv.org/abs/2605.15410v1,2026-05-14 20:50:42+00:00
15,Ising anyons in the $SU(2)_2$ Chern--Simons theory,2605.15268,http://arxiv.org/abs/2605.15268v1,2026-05-14 18:00:01+00:00
16,A Resource-Driven Framework for Configurable Entanglement in Quantum Networks,2605.15029,http://arxiv.org/abs/2605.15029v1,2026-05-14 16:26:00+00:00
17,Quantum Circuit Synthesis Using an Exact T Library,2605.15476,http://arxiv.org/abs/2605.15476v1,2026-05-14 23:34:01+00:00
18,Accurate Modeling of Rydberg Atoms and Their Interactions: Theory and Implementation in PairInteraction,2605.14993,http://arxiv.org/abs/2605.14993v1,2026-05-14 15:55:39+00:00
19,Stopping Reliability in Adaptive Krylov-Shadow Quantum Fisher Information Estimation,2605.14338,http://arxiv.org/abs/2605.14338v1,2026-05-14 04:02:23+00:00
20,Toward Covert Quantum Computing,2605.14325,http://arxiv.org/abs/2605.14325v1,2026-05-14 03:39:30+00:00
21,Worst-Case Sample Complexity Bounds for Distributed Inner Product Estimation with Local Randomized Measurements,2605.14256,http://arxiv.org/abs/2605.14256v1,2026-05-14 01:48:14+00:00
22,Quantum battery optimized by parametric amplification,2605.14582,http://arxiv.org/abs/2605.14582v1,2026-05-14 08:53:56+00:00
23,The Heisenberg-Weyl-parity group its coherent states and a unified Wigner-Weyl function,2605.14820,http://arxiv.org/abs/2605.14820v1,2026-05-14 13:30:59+00:00
24,Decoherence of $q-$Deformed Photon Added Coherent State,2605.14691,http://arxiv.org/abs/2605.14691v1,2026-05-14 11:04:15+00:00
25,Perfect transmission and parallel composition for quantum walks on graphs with two leads,2605.14640,http://arxiv.org/abs/2605.14640v1,2026-05-14 09:57:12+00:00
26,Quantum-Secure Physical Unclonable Function enabled by Silicon Photonics Integrated Circuits,2605.14959,http://arxiv.org/abs/2605.14959v1,2026-05-14 15:27:30+00:00
27,A Qutrit Time Crystal Stabilized with Native Chiral Interactions,2605.14293,http://arxiv.org/abs/2605.14293v1,2026-05-14 02:51:54+00:00
28,Accelerating State-Vector Quantum Simulation on Integrated GPUs via Cache Locality Optimization: A Cross-Architecture Evaluation,2605.15098,http://arxiv.org/abs/2605.15098v1,2026-05-14 17:17:02+00:00
29,Larkin-Ovchinnikov-Fulde-Ferrell state of spin polarized atomic Fermi superfluid on a spherical surface,2605.14985,http://arxiv.org/abs/2605.14985v1,2026-05-14 15:48:19+00:00
30,Superconducting single-photon detectors for integrated quantum photonics,2605.14829,http://arxiv.org/abs/2605.14829v1,2026-05-14 13:35:48+00:00
31,Nonlinear Hamiltonians and Boolean satisfiability,2605.14822,http://arxiv.org/abs/2605.14822v1,2026-05-14 13:32:16+00:00
32,Power sensitivity of broadband radiofrequency detectors based on quantum diamond spins,2605.14244,http://arxiv.org/abs/2605.14244v1,2026-05-14 01:22:00+00:00
33,Failure-Guided Fuzzing for Hybrid Quantum-Classical Programs,2605.14219,http://arxiv.org/abs/2605.14219v1,2026-05-14 00:27:32+00:00
34,Entanglement Dynamics of Separable Squeezed States in Finite Memory Structured Reservoir,2605.15426,http://arxiv.org/abs/2605.15426v1,2026-05-14 21:16:38+00:00
35,Coherent States of Non-Null Torus Knots,2605.15420,http://arxiv.org/abs/2605.15420v1,2026-05-14 21:06:56+00:00
36,Second-order moment equivalence of twisted Gaussian Schell model beams and orbital angular momentum eigenmodes,2605.15408,http://arxiv.org/abs/2605.15408v1,2026-05-14 20:48:36+00:00
37,Spin chirality across quantum state copies detects hidden entanglement,2605.14515,http://arxiv.org/abs/2605.14515v1,2026-05-14 07:59:40+00:00
38,Discrete-phase-randomized mode-pairing quantum key distribution,2605.14484,http://arxiv.org/abs/2605.14484v1,2026-05-14 07:24:40+00:00
39,Nonreciprocal magnon-magnon entanglement in a spinning cavity-magnon system,2605.14394,http://arxiv.org/abs/2605.14394v1,2026-05-14 05:17:38+00:00
40,Optimizing the preparation of Dicke states using counterdiabatic driving methods,2605.14378,http://arxiv.org/abs/2605.14378v1,2026-05-14 04:58:39+00:00
41,Fraxonium: Fractional fluxon states for qudit encoding,2605.14586,http://arxiv.org/abs/2605.14586v1,2026-05-14 08:58:07+00:00
42,Scalable self-testing of generic multipartite quantum states,2605.15106,http://arxiv.org/abs/2605.15106v1,2026-05-14 17:23:40+00:00
43,Non-Invertible Symmetries on Tensor-Product Hilbert Spaces and Quantum Cellular Automata,2605.15194,http://arxiv.org/abs/2605.15194v1,2026-05-14 17:59:45+00:00
44,Energy efficiency of quantum computers,2605.15090,http://arxiv.org/abs/2605.15090v1,2026-05-14 17:11:18+00:00
45,Quantum Meets Statistical-Physical Secrecy: A Novel Hybrid Key Distribution Architecture,2605.15247,http://arxiv.org/abs/2605.15247v1,2026-05-14 11:09:06+00:00
46,Translation symmetry-enforced long-range entanglement in mixed states,2605.15200,http://arxiv.org/abs/2605.15200v2,2026-05-14 17:59:57+00:00
47,QuChaTeR: A Hybrid Quantum-Chaotic Temporal Framework for Earthquake Prediction,2605.16454,http://arxiv.org/abs/2605.16454v1,2026-05-14 13:40:11+00:00
48,The influence of strong coupling between single-photon source and spectral filter on photon statistics,2605.14807,http://arxiv.org/abs/2605.14807v1,2026-05-14 13:20:30+00:00
49,Evolution of Gaussian mixed states under the Markovian master equation for a driven quantum oscillator,2605.14756,http://arxiv.org/abs/2605.14756v1,2026-05-14 12:21:53+00:00
50,Generating Non-Decomposable Maps with Differentiable Semidefinite Programming,2605.14644,http://arxiv.org/abs/2605.14644v1,2026-05-14 10:01:29+00:00
51,Timing Jitter Induced by Stochastic Baseline Fluctuations in High-Count-Rate Superconducting Nanowire Single-Photon Detectors,2605.14316,http://arxiv.org/abs/2605.14316v1,2026-05-14 03:27:05+00:00
52,Open Quantum Theory of Shot Noise in Dissipative Chiral Transport,2605.14263,http://arxiv.org/abs/2605.14263v1,2026-05-14 02:05:52+00:00
53,Quantum Advantage in Multi Agent Reinforcement Learning,2605.14235,http://arxiv.org/abs/2605.14235v1,2026-05-14 01:03:41+00:00
54,QSeqSim: A Symbolic Simulator for Qiskit While Loops Using Sequential Quantum Circuits,2605.14881,http://arxiv.org/abs/2605.14881v1,2026-05-14 14:25:39+00:00
55,Extensive long-range magic in non-Abelian topological orders,2605.15150,http://arxiv.org/abs/2605.15150v1,2026-05-14 17:50:20+00:00
56,"Two Protons, Two Positrons, and Four Electrons: Covalent Bond with van der Waals Characteristics",2605.15099,http://arxiv.org/abs/2605.15099v1,2026-05-14 17:19:09+00:00
57,Majorana Constellations: A Geometric Lens on Multipartite Entanglement and Geometric Phases,2605.15008,http://arxiv.org/abs/2605.15008v1,2026-05-14 16:09:15+00:00
58,Sharp Bounds on the Eigenvalues of Kikuchi Graphs and Applications to Quantum Max Cut,2605.14994,http://arxiv.org/abs/2605.14994v1,2026-05-14 15:56:29+00:00
59,Beyond Unitary Quantum Simulation: Open-System Approaches to Quantum Chemistry toward Quantum Advantage,2605.15277,http://arxiv.org/abs/2605.15277v1,2026-05-14 18:00:04+00:00
60,Entangled Telecom Photon Generation using Twisted Van der Waals Crystals,2605.14592,http://arxiv.org/abs/2605.14592v1,2026-05-14 09:02:13+00:00
61,Measurement-Efficient Variational Quantum Linear Solver for Carleman-Linearized Nonlinear Dynamics,2605.15366,http://arxiv.org/abs/2605.15366v1,2026-05-14 19:45:27+00:00
62,Blind Quantum Computation on a Modular Superconducting Processor,2605.14656,http://arxiv.org/abs/2605.14656v1,2026-05-14 10:11:33+00:00
63,Programmable cavity-enhanced telecom quantum memory in thin-film lithium niobate,2605.14777,http://arxiv.org/abs/2605.14777v1,2026-05-14 12:42:54+00:00
64,A Toolbox to Understand the Physics of Quantum Data Management,2605.14719,http://arxiv.org/abs/2605.14719v1,2026-05-14 11:40:34+00:00
65,Mixed-State Long-Range Entanglement from Dimensional Constraints,2605.15201,http://arxiv.org/abs/2605.15201v1,2026-05-14 17:59:59+00:00
66,Model Checking Matrix Product States against Linear Chain Logic,2605.14356,http://arxiv.org/abs/2605.14356v1,2026-05-14 04:33:59+00:00
67,"Are free choices absolute, when internalized in Wigner's friend?",2605.14538,http://arxiv.org/abs/2605.14538v1,2026-05-14 08:21:35+00:00
68,Quantum-enabled complete RF-polarimetry with an optically-wired atomic sensor,2605.14529,http://arxiv.org/abs/2605.14529v1,2026-05-14 08:11:11+00:00
69,HQTN-SER: Speech Emotion Recognition with Hybrid Quantum Tensor Networks,2605.14523,http://arxiv.org/abs/2605.14523v1,2026-05-14 08:07:58+00:00
70,Synthesis and Optimization of Encoding Circuits for Fault-Tolerant Quantum Computation,2605.15266,http://arxiv.org/abs/2605.15266v1,2026-05-14 18:00:01+00:00
71,A general proof of integer Rényi QNEC,2605.15272,http://arxiv.org/abs/2605.15272v1,2026-05-14 18:00:02+00:00
72,Telecom-Wavelength-Compatible Quantum Information Transcription Using Nitrogen-Vacancy Centers,2605.14697,http://arxiv.org/abs/2605.14697v1,2026-05-14 11:12:46+00:00
73,Clifford-deformed zero-rate LDPC codes with 50% biased noise thresholds,2605.15348,http://arxiv.org/abs/2605.15348v1,2026-05-14 19:18:25+00:00
74,Energy-space quantum walks: Thermalization without state convergence,2605.15339,http://arxiv.org/abs/2605.15339v1,2026-05-14 19:06:11+00:00
75,Towards Deploying Optimistic Quantum Fourier Transforms: An Architecture-Algorithm Co-Design Study,2605.15297,http://arxiv.org/abs/2605.15297v1,2026-05-14 18:11:04+00:00
76,Nonlocal Topological Maxwell Demon Teleporting Ergotropy via Surface-Code Quantum Error Correction,2605.14924,http://arxiv.org/abs/2605.14924v2,2026-05-14 14:58:52+00:00
77,Universal quantum resource distillation via composite generalised quantum Stein's lemma,2605.15174,http://arxiv.org/abs/2605.15174v1,2026-05-14 17:57:05+00:00
78,Additivity Results for the Rényi-2 Entanglement of Purification,2605.15439,http://arxiv.org/abs/2605.15439v1,2026-05-14 21:41:31+00:00
79,Single Spatio-Temporal Mode Bright Twin-Beam Source Across the Near- and Mid-Infrared,2605.15385,http://arxiv.org/abs/2605.15385v1,2026-05-14 20:15:37+00:00
80,Quantum Feature Pyramid Gating for Seismic Image Segmentation,2605.15370,http://arxiv.org/abs/2605.15370v1,2026-05-14 19:50:01+00:00
