,title,id,arxiv_url,published
0,Staying In Character: Perspective-Bounded Memory For Book-Based Role-Playing Agents,2606.25632,http://arxiv.org/abs/2606.25632v1,2026-06-24 09:37:49+00:00
1,Low-Complexity Policy Tessellations in Structured Markov Decision Processes,2606.25593,http://arxiv.org/abs/2606.25593v1,2026-06-24 09:00:16+00:00
2,STEB: A Speech-to-Speech Translation Expressiveness Benchmark for Evaluating Beyond Translation Fidelity,2606.25529,http://arxiv.org/abs/2606.25529v1,2026-06-24 08:06:41+00:00
3,The impact of artificial intelligence on enterprise software user roles,2606.25525,http://arxiv.org/abs/2606.25525v1,2026-06-24 08:04:30+00:00
4,TheoremGraph: Bridging Formal and Informal Mathematics,2606.25363,http://arxiv.org/abs/2606.25363v1,2026-06-24 03:47:05+00:00
5,Agentic Knowledge Tracing: A Multi-Agent LLM Architecture for Stealth Assessment of Financial Literacy in Serious Games,2606.25358,http://arxiv.org/abs/2606.25358v1,2026-06-24 03:43:59+00:00
6,UC-Search: Risk-Aware Test-Time Search for Delayed Constrained Time-Series Control,2606.25274,http://arxiv.org/abs/2606.25274v1,2026-06-24 01:15:24+00:00
7,Statistical and Structural Approaches to Algorithmic Fairness,2606.26200,http://arxiv.org/abs/2606.26200v1,2026-06-24 16:23:40+00:00
8,LiMoDE: Rethinking Lifelong Robot Manipulation from a Mixture-of-Dynamic-Experts Perspective,2606.26183,http://arxiv.org/abs/2606.26183v1,2026-06-24 13:18:43+00:00
9,KG-TRACE: A Neuro-Symbolic Framework for Mechanistic Grounding in Antimicrobial Resistance Prediction,2606.26179,http://arxiv.org/abs/2606.26179v1,2026-06-24 12:35:18+00:00
10,Cliff Tokens: Identifying Single-Token Failure Triggers in LLM Mathematical Reasoning,2606.25524,http://arxiv.org/abs/2606.25524v2,2026-06-24 08:03:24+00:00
11,Sarashina2.2-TTS: Tackling Kanji Polyphony in Japanese Speech Generation via Data Scaling and Targeted Data Synthesis,2606.25369,http://arxiv.org/abs/2606.25369v1,2026-06-24 03:57:21+00:00
12,Instruction Bleed: Cross-Module Interference in Prompt-Composed Agentic Systems,2606.26356,http://arxiv.org/abs/2606.26356v1,2026-06-24 20:09:28+00:00
13,What We are Missing in Multimodal LLM Evaluation?,2606.26348,http://arxiv.org/abs/2606.26348v1,2026-06-24 19:40:53+00:00
14,A cross-process welding penetration status prediction algorithm based on unsupervised domain adaptation in laser and TIG welding,2606.26078,http://arxiv.org/abs/2606.26078v1,2026-06-24 17:52:57+00:00
15,Can Trustless Agents Be Trusted? An Empirical Study of the ERC-8004 Decentralized AI Agent Ecosystem,2606.26028,http://arxiv.org/abs/2606.26028v1,2026-06-24 16:57:49+00:00
16,Hierarchical Reinforcement Learning for Neural Network Compression (HiReLC): Pruning and Quantization,2606.26002,http://arxiv.org/abs/2606.26002v1,2026-06-24 16:19:29+00:00
17,SpeechEQ: Benchmarking Emotional Intelligence Quotient in Socially Aware Voice Conversational Models,2606.25990,http://arxiv.org/abs/2606.25990v1,2026-06-24 16:03:38+00:00
18,Multi-Agent Goal Recognition with Team- and Goal-Conditioned Reinforcement Learning and Factorized Branch-and-Bound,2606.25978,http://arxiv.org/abs/2606.25978v1,2026-06-24 15:50:39+00:00
19,SE-AGCNet: An End-to-End Framework for Joint Speech Enhancement and Loudness Control in Meeting Scenarios,2606.25959,http://arxiv.org/abs/2606.25959v1,2026-06-24 15:32:42+00:00
20,Overview of HIPE-2026: Person-Place Relation Extraction from Multilingual Historical Texts,2606.25935,http://arxiv.org/abs/2606.25935v1,2026-06-24 15:09:12+00:00
21,Helpful or Harmful? Evaluating LLM-Assisted Vulnerability Patching via a Human Study,2606.25973,http://arxiv.org/abs/2606.25973v1,2026-06-24 15:45:38+00:00
22,Financing Artificial Intelligence Infrastructure: Mapping AI Infrastructure Investment and Compute Governance Across Africa,2606.28404,http://arxiv.org/abs/2606.28404v1,2026-06-24 13:14:02+00:00
23,Unbiased Canonical Set-Valued Oracles Via Lattice Theory,2606.26418,http://arxiv.org/abs/2606.26418v2,2026-06-24 22:20:13+00:00
24,Agentic Analysis for Agentic Infrastructure: An LLM-Powered Pipeline for Comparative Governance of DAO and Corporate AI Protocols,2606.26203,http://arxiv.org/abs/2606.26203v1,2026-06-24 16:34:54+00:00
25,AI Coaching for Accelerating Human Skill Development with Reinforcement Learning,2606.25337,http://arxiv.org/abs/2606.25337v1,2026-06-24 03:05:22+00:00
26,Geometry-Aware MCTS for Extremal Problems in Combinatorial Geometry,2606.26399,http://arxiv.org/abs/2606.26399v1,2026-06-24 21:34:08+00:00
27,"SidConArena: An Environment Evaluating Agents in Open-Ended,Positive-Sum Bargaining Game",2606.27397,http://arxiv.org/abs/2606.27397v1,2026-06-24 10:35:31+00:00
28,AI Snitches Get Glitches: Towards Evading Agentic Surveillance,2606.25836,http://arxiv.org/abs/2606.25836v2,2026-06-24 13:50:22+00:00
29,Quantization Inflates Reasoning: Token Inflation as a Hidden Cost of Low-Bit Reasoning Models,2606.25519,http://arxiv.org/abs/2606.25519v2,2026-06-24 07:54:55+00:00
30,Weave of Formal Thought,2606.25987,http://arxiv.org/abs/2606.25987v1,2026-06-24 15:58:11+00:00
31,WinDOM: Self-Family Distillation for Small-Model GUI Grounding,2606.25964,http://arxiv.org/abs/2606.25964v1,2026-06-24 15:35:29+00:00
32,Taxonomy of Risks on Automated Fact-Checking Systems Considering its Propagation,2606.25645,http://arxiv.org/abs/2606.25645v1,2026-06-24 09:53:23+00:00
33,OncoSynth: Synthetic data generation for treatment effect estimation in oncology,2606.25762,http://arxiv.org/abs/2606.25762v1,2026-06-24 12:37:36+00:00
34,Decoupling Reconnaissance and Exploitation: Measuring the Capability Boundaries of LLM-Based Web Penetration Testing,2606.25332,http://arxiv.org/abs/2606.25332v1,2026-06-24 02:51:58+00:00
35,Improved Large Language Diffusion Models,2606.25331,http://arxiv.org/abs/2606.25331v1,2026-06-24 02:51:36+00:00
36,AI-Assisted Computational Reproducibility on the FABRIC Testbed,2606.25879,http://arxiv.org/abs/2606.25879v1,2026-06-24 14:23:14+00:00
37,Position Spaces and Graphs,2606.25719,http://arxiv.org/abs/2606.25719v1,2026-06-24 11:36:00+00:00
38,Steering Vision-Language Models with Joint Sparse Autoencoders,2606.25657,http://arxiv.org/abs/2606.25657v1,2026-06-24 10:11:04+00:00
39,Evaluating LLMs on Real-World Software Performance Optimization,2606.25530,http://arxiv.org/abs/2606.25530v1,2026-06-24 08:07:41+00:00
40,HG-Bench: A Benchmark for Multi-Page Handwritten Answer-Region Grounding in Automated Homework Assessment,2606.25491,http://arxiv.org/abs/2606.25491v1,2026-06-24 07:18:50+00:00
41,Rate-Aware Quantum-Inspired Trajectory Learning for Interference-Limited Multi-UAV Networks,2606.25480,http://arxiv.org/abs/2606.25480v1,2026-06-24 07:10:37+00:00
42,C3-Bench: A Context-Aware Change Captioning Benchmark,2606.25445,http://arxiv.org/abs/2606.25445v1,2026-06-24 06:15:24+00:00
43,auto-psych: Automating the science of mind using agent-driven theory discovery and experimentation,2606.26460,http://arxiv.org/abs/2606.26460v1,2026-06-24 23:43:01+00:00
44,MKG-RAG-Bench: Benchmarking Retrieval in Multimodal Knowledge Graph-Augmented Generation,2606.26458,http://arxiv.org/abs/2606.26458v1,2026-06-24 23:38:42+00:00
45,Active Adversarial Perturbation-driven Associative Memory Retrieval for RGB-Event Visual Object Tracking,2606.26455,http://arxiv.org/abs/2606.26455v1,2026-06-24 23:34:06+00:00
46,Data-driven Machine Learning Cannot Reach Symbolic-level Logical Reasoning -- The Limit of the Scaling Law,2606.26454,http://arxiv.org/abs/2606.26454v1,2026-06-24 23:30:08+00:00
47,ProvenAI: Provenance-Native Traces of Evidence in Generated Answers,2606.26449,http://arxiv.org/abs/2606.26449v1,2026-06-24 23:22:38+00:00
48,WatchAct: A Benchmark for Behavior-Grounded Robot Manipulation,2606.26443,http://arxiv.org/abs/2606.26443v1,2026-06-24 23:13:56+00:00
49,SOLAR: AI-Powered Speed-of-Light Performance Analysis,2606.26383,http://arxiv.org/abs/2606.26383v1,2026-06-24 21:09:29+00:00
50,COrigami: An AI Pipeline for Co-Designing Flat-Foldable Visually Recognisable Origami,2606.26299,http://arxiv.org/abs/2606.26299v1,2026-06-24 18:43:24+00:00
51,"Governing Actions, Not Agents: Institutional Attestation as a Governance Model for Autonomous AI Systems",2606.26298,http://arxiv.org/abs/2606.26298v1,2026-06-24 18:43:00+00:00
52,AlgoEvolve: LLM-driven Meta-evolution of Algorithmic Trading Programs,2606.26173,http://arxiv.org/abs/2606.26173v1,2026-06-24 10:05:03+00:00
53,LCG: Long-Context Consistent Image Generation with Sparse Relational Attention,2606.26171,http://arxiv.org/abs/2606.26171v1,2026-06-24 09:34:10+00:00
54,MiniOpt: Reasoning to Model and Solve General Optimization Problems with Limited Resources,2606.25832,http://arxiv.org/abs/2606.25832v2,2026-06-24 13:48:06+00:00
55,Model Forensics: Investigating Whether Concerning Behavior Reflects Misalignment,2606.26071,http://arxiv.org/abs/2606.26071v2,2026-06-24 17:45:47+00:00
56,Pulmonary Embolism Risk Stratification from CTPA and Medical Records: Vascular Graphs Are Not All You Need,2606.25956,http://arxiv.org/abs/2606.25956v2,2026-06-24 15:28:27+00:00
57,Reinforcement Learning for Software Vulnerability Analysis: A Systematic Review with Emphasis on C/C++ Source Code and Static Analysis,2606.28403,http://arxiv.org/abs/2606.28403v1,2026-06-24 13:09:42+00:00
58,Reclaim Evaluation: A Lossy Memory Is Worse Than an Empty One,2606.25449,http://arxiv.org/abs/2606.25449v2,2026-06-24 06:24:53+00:00
59,Color Matters: Trigger Color Affects Success in Federated Backdoor Attacks,2606.25858,http://arxiv.org/abs/2606.25858v1,2026-06-24 14:07:10+00:00
60,SARA: Unlocking Multilingual Knowledge in Mixture-of-Experts via Semantically Anchored Routing Alignment,2606.25821,http://arxiv.org/abs/2606.25821v1,2026-06-24 13:36:46+00:00
61,Fuzzy Quantification over OWL Ontologies and Knowledge Graphs,2606.25778,http://arxiv.org/abs/2606.25778v1,2026-06-24 12:56:05+00:00
62,Space-Efficient Language Generation in the Limit,2606.25777,http://arxiv.org/abs/2606.25777v1,2026-06-24 12:55:34+00:00
63,Point Cloud Diffusion with Global and Local Reconstruction for Instance-Level 3D Anomaly Detection,2606.25740,http://arxiv.org/abs/2606.25740v1,2026-06-24 12:11:05+00:00
64,Power-Budgeted Underwater Vehicle Control via Constrained Reinforcement Learning,2606.25680,http://arxiv.org/abs/2606.25680v1,2026-06-24 10:48:30+00:00
65,Reasonable Motion: A General ASP Foundation for Environment Constrained Movement Trajectory Computation,2606.25626,http://arxiv.org/abs/2606.25626v1,2026-06-24 09:34:24+00:00
66,Confidence Sequences for Online Statistical Model Checking of Markov Decision Processes,2606.25797,http://arxiv.org/abs/2606.25797v1,2026-06-24 13:16:08+00:00
67,Adaptive Oscillatory Inductive Bias for Modeling Sharp Prosodic Dynamics in Diffusion-Based TTS,2606.25424,http://arxiv.org/abs/2606.25424v1,2026-06-24 05:32:20+00:00
68,From Structure to Synergy: A Survey of Vision-Language Perception Paradigm Evolution in Multimodal Large Language Models,2606.26196,http://arxiv.org/abs/2606.26196v1,2026-06-24 15:20:32+00:00
69,Refusal Lives Downstream of Persona in Chat Models,2606.26161,http://arxiv.org/abs/2606.26161v1,2026-06-24 04:25:59+00:00
70,Estimating Uncertainty in Classifier Performance with Applications to Large Language Models and Nested Data,2606.26422,http://arxiv.org/abs/2606.26422v1,2026-06-24 22:24:25+00:00
71,Beyond Feedforward Networks: Reentry Neural Systems as the Fundamental Basis of Subjecthood and Intrinsic Safety of Next-Generation AGI,2606.26406,http://arxiv.org/abs/2606.26406v1,2026-06-24 21:54:02+00:00
72,Sampling sea state using a diffusion model,2606.26389,http://arxiv.org/abs/2606.26389v1,2026-06-24 21:19:59+00:00
73,Narration-of-Thought: Inference-Time Scaffolding for Defeasible Ethical Reasoning in Large Language Models,2606.26366,http://arxiv.org/abs/2606.26366v1,2026-06-24 20:23:16+00:00
74,How Do Tool-Augmented LLM Agents Perform on Real-World Energy Analytics Tasks?,2606.26346,http://arxiv.org/abs/2606.26346v1,2026-06-24 19:38:21+00:00
75,EVOM: Agentic Meta-Evolution of Actor-Critic Architectures for Reinforcement Learning,2606.26327,http://arxiv.org/abs/2606.26327v1,2026-06-24 19:13:32+00:00
76,Parametric Generalized Adaptive Moment Features (PG-AMF) for Bearing Fault Diagnosis and Machine Health Monitoring,2606.26317,http://arxiv.org/abs/2606.26317v1,2026-06-24 19:02:23+00:00
77,SSM Adapters via Hankel Reduced-order Modeling: Injection Site Determines Task Suitability in Long-Context Fine-Tuning,2606.26290,http://arxiv.org/abs/2606.26290v1,2026-06-24 18:36:31+00:00
78,TEMPO-Diffusion: Temporally Exposed Malicious Poisoning of Diffusion Models,2606.26285,http://arxiv.org/abs/2606.26285v1,2026-06-24 18:31:06+00:00
79,TL++: Accuracy and Privacy Preserving Traversal Learning for Distributed Intelligent Systems,2606.25627,http://arxiv.org/abs/2606.25627v1,2026-06-24 09:34:27+00:00
80,Expresso-AI: Explainable Video-Based Deep Learning Models for Depression Diagnosis,2606.25606,http://arxiv.org/abs/2606.25606v1,2026-06-24 09:14:53+00:00
81,Learning with a Single Rollout via Monte Carlo Pass@k Critic,2606.25451,http://arxiv.org/abs/2606.25451v1,2026-06-24 06:26:34+00:00
82,TopoCast: A Topological Fidelity Framework for Evaluating Transformer-Based Time Series Forecasting,2606.25439,http://arxiv.org/abs/2606.25439v1,2026-06-24 06:03:39+00:00
83,Offline Multi-agent Continual Cooperation via Skill Partition and Reuse,2606.25389,http://arxiv.org/abs/2606.25389v1,2026-06-24 04:40:21+00:00
84,Beyond Visual Forensics: Auditing Multimodal Robustness for Synthetic Medical Image Detection,2606.25375,http://arxiv.org/abs/2606.25375v1,2026-06-24 04:08:41+00:00
85,What Actually Works for Spacecraft Fault-Tolerant Control: An Honest Settled-Gate Benchmark of Learned and Classical Methods,2606.25374,http://arxiv.org/abs/2606.25374v1,2026-06-24 04:08:39+00:00
86,Neural Machine Translation for Low-Resource Tangkhul--English,2606.25365,http://arxiv.org/abs/2606.25365v1,2026-06-24 03:54:46+00:00
87,Omni-Perception Policy Optimization for Multimodal Emotion Reasoning,2606.25325,http://arxiv.org/abs/2606.25325v1,2026-06-24 02:43:26+00:00
88,Physics Question Scene Graph: Fine-grained Evaluation of Physical Plausibility in Text-to-Video Generation,2606.25306,http://arxiv.org/abs/2606.25306v1,2026-06-24 02:12:54+00:00
89,Agentic System as Compressor: Quantifying System Intelligence in Bits,2606.25960,http://arxiv.org/abs/2606.25960v1,2026-06-24 15:32:49+00:00
90,Learning Action Priors for Cross-embodiment Robot Manipulation,2606.26095,http://arxiv.org/abs/2606.26095v1,2026-06-24 17:59:56+00:00
91,On-Policy Self-Distillation with Sampled Demonstrations Reduces Output Diversity,2606.26091,http://arxiv.org/abs/2606.26091v1,2026-06-24 17:59:02+00:00
92,A welding penetration prediction model for laser welding process based on self-supervised learning using physics-informed neural networks,2606.26059,http://arxiv.org/abs/2606.26059v1,2026-06-24 17:33:41+00:00
93,The Unfireable Safety Kernel: Execution-Time AI Alignment for AI Agents and Other Escapable AI Systems,2606.26057,http://arxiv.org/abs/2606.26057v1,2026-06-24 17:32:27+00:00
94,Natural Ungrokking: Asymmetric Control of Which Rules Survive Pretraining,2606.26050,http://arxiv.org/abs/2606.26050v1,2026-06-24 17:27:13+00:00
95,FORCE: Efficient VLA Reinforcement Fine-Tuning via Value-Calibrated Warm-up and Self-Distillation,2606.26006,http://arxiv.org/abs/2606.26006v1,2026-06-24 16:23:18+00:00
96,Variable Bound Tightening for Nash Equilibrium Computation in Multiplayer Imperfect-Information Games,2606.25997,http://arxiv.org/abs/2606.25997v1,2026-06-24 16:08:33+00:00
97,Lacuna: A Research Map for Machine Learning,2606.26246,http://arxiv.org/abs/2606.26246v1,2026-06-24 18:00:12+00:00
98,OpenFinGym: A Verifiable Multi-Task Gym Environment for Evaluating Quant Agents,2606.26350,http://arxiv.org/abs/2606.26350v1,2026-06-24 19:42:55+00:00
99,Enhancing Brain MRI Anomaly Detection and Reasoning with ROI Rethink and Synthetic Data,2606.25894,http://arxiv.org/abs/2606.25894v1,2026-06-24 14:41:27+00:00
