,title,id,arxiv_url,published
0,Data-Efficient Error Mitigation for Physical and Algorithmic Errors in a Hamiltonian Simulation,2503.05052,http://arxiv.org/abs/2503.05052v1,2025-03-07 00:05:52+00:00
1,Hybrid Implementation for Untrusted-node-based Quantum Key Distribution Network,2503.05095,http://arxiv.org/abs/2503.05095v1,2025-03-07 02:27:41+00:00
2,Direct Gradient Computation of Parameterized Quantum Circuits,2503.05145,http://arxiv.org/abs/2503.05145v1,2025-03-07 05:06:04+00:00
3,Extended Controllability Tests for Quantum Decoherence-Free Subspaces,2503.05155,http://arxiv.org/abs/2503.05155v1,2025-03-07 05:28:36+00:00
4,Nonviolation of the CHSH inequality under local spin-1 measurements on two spin qutrits,2503.05172,http://arxiv.org/abs/2503.05172v1,2025-03-07 06:35:21+00:00
5,Nonstabilizerness of a Boundary Time Crystal,2503.05243,http://arxiv.org/abs/2503.05243v1,2025-03-07 08:54:53+00:00
6,Spectrum analysis with parametrically modulated transmon qubits,2503.05258,http://arxiv.org/abs/2503.05258v1,2025-03-07 09:16:20+00:00
7,Performance Comparison of Quantum Otto and Stirling Engines Using Atom-Photon Interactions,2503.05314,http://arxiv.org/abs/2503.05314v1,2025-03-07 10:48:12+00:00
8,Implementation and verification of coherent error suppression using randomized compiling for Grover's algorithm on a trapped-ion device,2503.05344,http://arxiv.org/abs/2503.05344v1,2025-03-07 11:37:14+00:00
9,Maxwell demon no-go theorem for multichannel scattering,2503.05377,http://arxiv.org/abs/2503.05377v1,2025-03-07 12:39:41+00:00
10,Quantum smoothed particle hydrodynamics algorithm inspired by quantum walks,2503.05393,http://arxiv.org/abs/2503.05393v1,2025-03-07 13:09:33+00:00
11,Cooperative squeezing of internal and collective spins in an atomic ensemble,2503.05446,http://arxiv.org/abs/2503.05446v1,2025-03-07 14:16:57+00:00
12,De Novo Design of Protein-Binding Peptides by Quantum Computing,2503.05458,http://arxiv.org/abs/2503.05458v1,2025-03-07 14:31:14+00:00
13,Compare Similarities Between DNA Sequences Using Permutation-Invariant Quantum Kernel,2503.05465,http://arxiv.org/abs/2503.05465v1,2025-03-07 14:35:38+00:00
14,Desorption-induced decoherence of nanoparticle motion,2503.05475,http://arxiv.org/abs/2503.05475v1,2025-03-07 14:47:31+00:00
15,Complete Characterization of Statistical Constraints in Local Realism and Quantum Mechanics via a Unified Geometric Framework,2503.05523,http://arxiv.org/abs/2503.05523v1,2025-03-07 15:45:56+00:00
16,Exploring Tensor Network Algorithms as a Quantum-Inspired Method for Quantum Reservoir Computing,2503.05535,http://arxiv.org/abs/2503.05535v1,2025-03-07 16:03:24+00:00
17,Generation of Frequency-Tunable Shaped Single Microwave Photons Using a Fixed-Frequency Superconducting Qubit,2503.05536,http://arxiv.org/abs/2503.05536v1,2025-03-07 16:03:33+00:00
18,"Less Quantum, More Advantage: An End-to-End Quantum Algorithm for the Jones Polynomial",2503.05625,http://arxiv.org/abs/2503.05625v1,2025-03-07 17:50:48+00:00
19,Phase estimation with partially randomized time evolution,2503.05647,http://arxiv.org/abs/2503.05647v1,2025-03-07 18:09:32+00:00
20,Memory preservation in highly-connected quantum networks,2503.05655,http://arxiv.org/abs/2503.05655v1,2025-03-07 18:16:08+00:00
21,"Local unambiguous unidentifiability, entanglement generation, and Hilbert space splitting",2503.05673,http://arxiv.org/abs/2503.05673v1,2025-03-07 18:33:19+00:00
22,Dynamics of disordered quantum systems with two- and three-dimensional tensor networks,2503.05693,http://arxiv.org/abs/2503.05693v2,2025-03-07 18:58:03+00:00
23,Fast and memory efficient strong simulation of noisy adaptive linear optical circuits,2503.05699,http://arxiv.org/abs/2503.05699v1,2025-03-07 18:59:16+00:00
24,Mentor initiated Bi-directional Hybrid quantum Communication Protocol,2503.05847,http://arxiv.org/abs/2503.05847v1,2025-03-07 06:35:26+00:00
25,Reassessing the boundary between classical and nonclassical for individual quantum processes,2503.05884,http://arxiv.org/abs/2503.05884v1,2025-03-07 19:09:45+00:00
26,When Clifford benchmarks are sufficient; estimating application performance with scalable proxy circuits,2503.05943,http://arxiv.org/abs/2503.05943v1,2025-03-07 21:18:59+00:00
27,Molecular representations of quantum circuits for quantum machine learning,2503.05955,http://arxiv.org/abs/2503.05955v1,2025-03-07 21:49:48+00:00
28,Enhancing the accuracy and efficiency of sample-based quantum diagonalization with phaseless auxiliary-field quantum Monte Carlo,2503.05967,http://arxiv.org/abs/2503.05967v1,2025-03-07 22:38:22+00:00
29,Programmable non-Hermitian photonic quantum walks via dichroic metasurfaces,2503.05072,http://arxiv.org/abs/2503.05072v1,2025-03-07 01:32:15+00:00
30,Calculation of low-energy scattering parameters using artificial oscillator trap,2503.05295,http://arxiv.org/abs/2503.05295v1,2025-03-07 10:19:04+00:00
31,Preparing Tetra-Digit Long-Range Entangled States via Unified Sequential Quantum Circuit,2503.05374,http://arxiv.org/abs/2503.05374v1,2025-03-07 12:32:13+00:00
32,Quantum decoherence of nitrogen-vacancy spin ensembles in a nitrogen spin bath in diamond under dynamical decoupling,2503.05404,http://arxiv.org/abs/2503.05404v1,2025-03-07 13:27:27+00:00
33,Metrological symmetries in singular quantum multi-parameter estimation,2503.05483,http://arxiv.org/abs/2503.05483v1,2025-03-07 14:52:40+00:00
34,Improved Two-source Extractors against Quantum Side Information,2503.05528,http://arxiv.org/abs/2503.05528v1,2025-03-07 15:49:55+00:00
35,On the similarity of bandwidth-tuned quantum kernels and classical kernels,2503.05602,http://arxiv.org/abs/2503.05602v1,2025-03-07 17:28:02+00:00
36,Selective collective emission from a dense atomic ensemble coupled to a nanophotonic resonator,2503.05664,http://arxiv.org/abs/2503.05664v1,2025-03-07 18:25:04+00:00
37,Quantum systems of atoms with highly singular interaction potentials,2503.08702,http://arxiv.org/abs/2503.08702v1,2025-03-07 18:43:55+00:00
38,Quantum Dual Extended Hamming Code Immune to Collective Coherent Errors,2503.05249,http://arxiv.org/abs/2503.05249v1,2025-03-07 09:05:43+00:00
39,Non-equilibirum physics of density-difference dependent Hamiltonian: Quantum Scarring from Emergent Chiral Symmetry,2503.05252,http://arxiv.org/abs/2503.05252v1,2025-03-07 09:09:24+00:00
40,Testing classicality of gravity by gravitation decoherence,2503.05350,http://arxiv.org/abs/2503.05350v1,2025-03-07 11:48:45+00:00
41,Step-by-step design guide of a cryogenic three-axis vector magnet,2503.05459,http://arxiv.org/abs/2503.05459v1,2025-03-07 14:32:11+00:00
42,Quantum gas microscopy of three-flavor Hubbard systems,2503.05687,http://arxiv.org/abs/2503.05687v1,2025-03-07 18:51:01+00:00
43,Quantum-like cognition and decision making in the light of quantum measurement theory,2503.05859,http://arxiv.org/abs/2503.05859v1,2025-03-07 18:30:44+00:00
44,Electric polarization in Chern insulators: Unifying many-body and single-particle approaches,2503.05864,http://arxiv.org/abs/2503.05864v1,2025-03-07 19:00:00+00:00
45,Quantum Schrodinger bridges: large deviations and time-symmetric ensembles,2503.05886,http://arxiv.org/abs/2503.05886v1,2025-03-07 19:20:07+00:00
46,Bypassing orthogonalization in the quantum DPP sampler,2503.05906,http://arxiv.org/abs/2503.05906v1,2025-03-07 19:57:39+00:00
47,Femtosecond Temporal Phase-Resolved Nonlinear Optical Spectroscopy in Molecules with Lock-in Enabled Phase Tracking,2503.05986,http://arxiv.org/abs/2503.05986v1,2025-03-07 23:45:51+00:00
48,Quantum State Designs from Minimally Random Quantum Circuits,2503.05698,http://arxiv.org/abs/2503.05698v1,2025-03-07 18:59:10+00:00
