,title,id,arxiv_url,published
0,Mixed-register Stabilizer Codes: A Coding-theoretic Perspective,2603.28459,http://arxiv.org/abs/2603.28459v1,2026-03-30 14:01:22+00:00
1,Q-DIVER: Integrated Quantum Transfer Learning and Differentiable Quantum Architecture Search with EEG Data,2603.28122,http://arxiv.org/abs/2603.28122v1,2026-03-30 07:37:53+00:00
2,Graphitic-C3N4/TiO2(B) S-scheme Heterojunctions for Efficient Photocatalytic H2 Production and Organic Pollution Degradation,2603.27989,http://arxiv.org/abs/2603.27989v1,2026-03-30 03:21:23+00:00
3,Hybrid QPE-Ansatz Strategy for Reliable Excited-State Variational Quantum Deflation,2603.27978,http://arxiv.org/abs/2603.27978v1,2026-03-30 02:57:09+00:00
4,Iterative Optimization with Partial Convergence Guarantees on Neutral Atom Quantum Computers,2603.28933,http://arxiv.org/abs/2603.28933v1,2026-03-30 19:12:21+00:00
5,Emergent-Coupling-Based Ansatz Evaluated on a Superconducting Quantum Processor,2603.28486,http://arxiv.org/abs/2603.28486v1,2026-03-30 14:21:35+00:00
6,Discriminating idempotent quantum channels,2603.28582,http://arxiv.org/abs/2603.28582v1,2026-03-30 15:31:40+00:00
7,Device independent quantum key distribution with robust self-tests,2603.28085,http://arxiv.org/abs/2603.28085v1,2026-03-30 06:40:22+00:00
8,Self-Reflection in a Moving Mirror,2603.28030,http://arxiv.org/abs/2603.28030v1,2026-03-30 04:48:01+00:00
9,Quantum-Coherent Regime of Programmable Dipolar Spin Ice,2603.28125,http://arxiv.org/abs/2603.28125v1,2026-03-30 07:44:02+00:00
10,The Contextual Modal Logic of a Wigner's Friend Generalization,2603.29028,http://arxiv.org/abs/2603.29028v1,2026-03-30 21:39:05+00:00
11,First-Click Time Measurements,2603.28623,http://arxiv.org/abs/2603.28623v1,2026-03-30 16:07:20+00:00
12,Can Quantum Field Theory be Recovered from Time-Symmetric Stochastic Mechanics? Part II: Prospects for a Trajectory Interpretation,2603.28983,http://arxiv.org/abs/2603.28983v1,2026-03-30 20:31:35+00:00
13,SesQ: A Surface Electrostatic Simulator for Precise Energy Participation Ratio Simulation in Superconducting Qubits,2603.28524,http://arxiv.org/abs/2603.28524v1,2026-03-30 14:51:55+00:00
14,Topological Optical Chirality Dichroism,2603.28752,http://arxiv.org/abs/2603.28752v1,2026-03-30 17:55:38+00:00
15,Hunting for quantum advantage in electronic structure calculations is a highly non-trivial task,2603.28648,http://arxiv.org/abs/2603.28648v1,2026-03-30 16:32:47+00:00
16,Exact $\mathbb{Z}_2$ electromagnetic duality of $\mathbb{Z}_2$ toric code is non-Clifford,2603.28230,http://arxiv.org/abs/2603.28230v2,2026-03-30 09:53:11+00:00
17,"Remarks on ""Further comments on ""Rebuttal of ""Refutation of ""Comment on ""Reply to ""Comments on ""A genuinely natural information measure"" "" "" "" "" "" """,2603.28975,http://arxiv.org/abs/2603.28975v1,2026-03-30 20:20:38+00:00
18,Process-tensor approach to full counting statistics of charge transport in quantum many-body circuits,2603.28894,http://arxiv.org/abs/2603.28894v1,2026-03-30 18:17:19+00:00
19,Quantum Suicide in Many-Worlds Implies P=NP,2603.28869,http://arxiv.org/abs/2603.28869v1,2026-03-30 18:00:08+00:00
20,Entanglement generation of arbitrary squeezed Fock states,2603.28077,http://arxiv.org/abs/2603.28077v1,2026-03-30 06:29:40+00:00
21,Learning unified control of internal spin squeezing in atomic qudits for magnetometry,2603.28421,http://arxiv.org/abs/2603.28421v1,2026-03-30 13:29:45+00:00
22,Towards Analyzing Formic Acid Using Classical and Quantum Methods,2603.28343,http://arxiv.org/abs/2603.28343v1,2026-03-30 12:13:12+00:00
23,Quantum engineering with ultracold polar molecules using trap-induced resonances,2603.28270,http://arxiv.org/abs/2603.28270v1,2026-03-30 10:53:59+00:00
24,Oxide-nitride heteroepitaxy for low-loss dielectrics in superconducting quantum circuits,2603.29065,http://arxiv.org/abs/2603.29065v1,2026-03-30 23:05:18+00:00
25,Neural Quantum States in Non-Stabilizer Regimes: Benchmarks with Atomic Nuclei,2603.28646,http://arxiv.org/abs/2603.28646v1,2026-03-30 16:29:42+00:00
26,From Hole Theory to Quantum Field Theory: Relativistic Fermions and the Role of Ettore Majorana (1933-1937),2603.28538,http://arxiv.org/abs/2603.28538v1,2026-03-30 15:00:10+00:00
27,The Power of Power-of-SWAP: Postselected Quantum Computation with the Exchange Interaction,2603.28527,http://arxiv.org/abs/2603.28527v1,2026-03-30 14:53:42+00:00
28,Photon-triplets for quantum optics generated by a phase-matched third-order difference-frequency mixing in a KTiOPO4 bulk crystal pumped at 532 nm,2603.28519,http://arxiv.org/abs/2603.28519v1,2026-03-30 14:48:26+00:00
29,Phase statistics of a single qubit emission as a direct probe of its coherence,2603.28433,http://arxiv.org/abs/2603.28433v1,2026-03-30 13:40:39+00:00
30,The force of attraction between nucleons due to vacuum fluctuation,2603.28379,http://arxiv.org/abs/2603.28379v1,2026-03-30 12:45:48+00:00
31,Compact Continuous-Variable Quantum Key Distribution System Employing Monolithically Integrated Silicon Photonic Transceiver,2603.28310,http://arxiv.org/abs/2603.28310v1,2026-03-30 11:33:36+00:00
32,Learning from imperfect quantum data via unsupervised domain adaptation with classical shadows,2603.28294,http://arxiv.org/abs/2603.28294v1,2026-03-30 11:20:34+00:00
33,Geometric Foundations of Stochastic and Quantum Dynamics,2603.28292,http://arxiv.org/abs/2603.28292v1,2026-03-30 11:12:47+00:00
34,Hybrid Quantum-Classical AI for Industrial Defect Classification in Welding Images,2603.28995,http://arxiv.org/abs/2603.28995v1,2026-03-30 20:48:51+00:00
35,"Bell's Inequality, Causal Bounds, and Quantum Bayesian Computation: A Unified Framework",2603.28973,http://arxiv.org/abs/2603.28973v1,2026-03-30 20:18:16+00:00
36,Perspective of Fermi's golden rule and its generalizations in chemical physics,2603.28373,http://arxiv.org/abs/2603.28373v2,2026-03-30 12:40:21+00:00
37,Modeling Quantum Optomechanical STIRAP,2603.28692,http://arxiv.org/abs/2603.28692v1,2026-03-30 17:12:47+00:00
38,Efficient and Practical Black-Box Verification of Quantum Metric Learning Algorithms,2603.28687,http://arxiv.org/abs/2603.28687v1,2026-03-30 17:07:43+00:00
39,Efficient Quantum Algorithm for Robust Training,2603.28332,http://arxiv.org/abs/2603.28332v1,2026-03-30 12:03:16+00:00
40,"Shor's algorithm is possible with as few as 10,000 reconfigurable atomic qubits",2603.28627,http://arxiv.org/abs/2603.28627v1,2026-03-30 16:10:08+00:00
41,Quantum Riemannian Hamiltonian Descent,2603.28624,http://arxiv.org/abs/2603.28624v1,2026-03-30 16:08:26+00:00
42,Non-stabilizerness and U(1) symmetry in chaotic many-body quantum systems,2603.28870,http://arxiv.org/abs/2603.28870v1,2026-03-30 18:00:10+00:00
43,Quantum Optical Neuron for Image Classification via Multiphoton Interference,2603.28879,http://arxiv.org/abs/2603.28879v1,2026-03-30 18:01:45+00:00
44,Geometric structure of the relativistic quantum phase space,2603.28836,http://arxiv.org/abs/2603.28836v1,2026-03-30 10:24:19+00:00
45,Open-System Adiabatic Quantum Search under Dephasing,2603.28506,http://arxiv.org/abs/2603.28506v1,2026-03-30 14:42:03+00:00
46,The local characterization of global tensor network eigenstates,2603.28349,http://arxiv.org/abs/2603.28349v1,2026-03-30 12:18:37+00:00
47,Entanglement of minimal dimension and a class of local state discrimination problems,2603.28284,http://arxiv.org/abs/2603.28284v1,2026-03-30 11:04:58+00:00
48,Resonance fluorescence of an artificial atom with a time-delayed coherent feedback,2603.28004,http://arxiv.org/abs/2603.28004v1,2026-03-30 03:55:08+00:00
49,Effects of measurements on entanglement dynamics for $1+1$D $\mathbb Z_2$ lattice gauge theory,2603.28877,http://arxiv.org/abs/2603.28877v1,2026-03-30 18:01:11+00:00
50,Exact Skin Critical Phase and Configurable Fractal Wavefunctions via Imaginary Gauge Phase Imprint in Non-Hermitian Lattices,2603.28153,http://arxiv.org/abs/2603.28153v1,2026-03-30 08:18:38+00:00
51,Quantized Dissipation from the Inverse-Square Anomaly in a Non-Hermitian Klein-Gordon Field,2603.28525,http://arxiv.org/abs/2603.28525v1,2026-03-30 14:52:45+00:00
52,$1/N^2$ Precision Interferometry with Collectively Enhanced Atomic Mirror,2603.28471,http://arxiv.org/abs/2603.28471v1,2026-03-30 14:10:22+00:00
53,Construction and characterization of measures in block coherence resource theory,2603.28712,http://arxiv.org/abs/2603.28712v1,2026-03-30 17:29:06+00:00
54,Lindbladian Simulation with Commutator Bounds,2603.28602,http://arxiv.org/abs/2603.28602v1,2026-03-30 15:51:50+00:00
55,Average Equilibration Time for Gaussian Unitary Ensemble Hamiltonians,2603.28587,http://arxiv.org/abs/2603.28587v1,2026-03-30 15:35:04+00:00
56,Probing excited-state quantum phase transitions with trapped cold ions,2603.28509,http://arxiv.org/abs/2603.28509v1,2026-03-30 14:43:34+00:00
57,Invariant measures of randomized quantum trajectories,2603.28664,http://arxiv.org/abs/2603.28664v1,2026-03-30 16:49:36+00:00
58,Color code off-the-hook: avoiding hook errors with a single auxiliary per plaquette,2603.28852,http://arxiv.org/abs/2603.28852v1,2026-03-30 18:00:01+00:00
59,Resource-efficient quantum approximate optimization algorithm via Bayesian optimization and maximum-probability evaluation,2603.28413,http://arxiv.org/abs/2603.28413v2,2026-03-30 13:22:25+00:00
60,Local robust shadows on a trapped ion computer -- a case study,2603.28307,http://arxiv.org/abs/2603.28307v1,2026-03-30 11:32:30+00:00
61,Symmetry-Fractionalized Skin Effects in Non-Hermitian Luttinger Liquids,2603.28849,http://arxiv.org/abs/2603.28849v1,2026-03-30 18:00:00+00:00
62,Adiabatic dressing of quantum enhanced Markov chains,2603.28076,http://arxiv.org/abs/2603.28076v1,2026-03-30 06:26:48+00:00
63,Qubit-efficient embedding of parity-encoded Hamiltonians in quantum annealers,2603.28667,http://arxiv.org/abs/2603.28667v1,2026-03-30 16:51:32+00:00
64,Tunable Nonlocal ZZ Interaction for Remote Controlled-Z Gates Between Distributed Fixed-Frequency Qubits,2603.28526,http://arxiv.org/abs/2603.28526v1,2026-03-30 14:52:46+00:00
65,Contextuality of quantum non-demolition measurement via state discrimination,2603.27917,http://arxiv.org/abs/2603.27917v1,2026-03-30 00:15:45+00:00
66,Central Limit Theorems for Outcome Records in Disordered Quantum Trajectories,2603.28893,http://arxiv.org/abs/2603.28893v1,2026-03-30 18:17:02+00:00
67,Real Variance-Based Variational Quantum Eigensolver for Non-Hermitian Matrices,2603.28892,http://arxiv.org/abs/2603.28892v1,2026-03-30 18:16:42+00:00
68,Higgs Boson Spookiness: Probing Quantum Nonlocality with Spacetime-Resolved $H\rightarrowτ^+τ^-$ Decays,2603.28868,http://arxiv.org/abs/2603.28868v1,2026-03-30 18:00:08+00:00
69,Genuine and Non-Genuine Quantum Non-Markovianity: A Unified Information-Theoretic Review,2603.28277,http://arxiv.org/abs/2603.28277v2,2026-03-30 10:59:16+00:00
70,Securing Elliptic Curve Cryptocurrencies against Quantum Vulnerabilities: Resource Estimates and Mitigations,2603.28846,http://arxiv.org/abs/2603.28846v1,2026-03-30 17:59:25+00:00
71,Zeno-Constrained Formation of Relativistic Mass Shells,2604.00051,http://arxiv.org/abs/2604.00051v1,2026-03-30 20:17:51+00:00
