,title,id,arxiv_url,published
0,Quantum Entanglement Distribution via Uplink Satellite Channels,2409.19985,http://arxiv.org/abs/2409.19985v1,2024-09-30 06:25:56+00:00
1,Control sequences for Nitrogen-Vacancy centers in the high frequency regime,2409.19994,http://arxiv.org/abs/2409.19994v1,2024-09-30 06:31:50+00:00
2,Universal quantum computing with a single arbitrary gate,2409.20025,http://arxiv.org/abs/2409.20025v1,2024-09-30 07:30:57+00:00
3,Learning Parameterized Quantum Circuits with Quantum Gradient,2409.20044,http://arxiv.org/abs/2409.20044v1,2024-09-30 07:50:47+00:00
4,Local contextuality-based self-tests are sufficient for randomness expansion secure against quantum adversaries,2409.20082,http://arxiv.org/abs/2409.20082v1,2024-09-30 08:31:46+00:00
5,Tunable photon scattering by qubit-photon bound states in a photonic crystal waveguide,2409.20300,http://arxiv.org/abs/2409.20300v1,2024-09-30 13:57:58+00:00
6,Orthogonal-state-based Measurement Device Independent Quantum Communication,2409.20438,http://arxiv.org/abs/2409.20438v1,2024-09-30 15:57:17+00:00
7,Universal quantum theory contains twisted logic,2409.20480,http://arxiv.org/abs/2409.20480v1,2024-09-30 16:40:58+00:00
8,Randomness from Radiation: Evaluation and Analysis of Radiation-Based Random Number Generators,2409.20492,http://arxiv.org/abs/2409.20492v1,2024-09-30 16:54:35+00:00
9,Creating Automated Quantum-Assisted Solutions for Optimization Problems,2409.20496,http://arxiv.org/abs/2409.20496v1,2024-09-30 16:59:14+00:00
10,A Compact Quantum Random Number Generator Based on Balanced Detection of Shot Noise,2409.20515,http://arxiv.org/abs/2409.20515v1,2024-09-30 17:18:45+00:00
11,Covariant Quantum Error-Correcting Codes with Metrological Entanglement Advantage,2409.20561,http://arxiv.org/abs/2409.20561v1,2024-09-30 17:59:01+00:00
12,Qibocal: an open-source framework for calibration of self-hosted quantum devices,2410.00101,http://arxiv.org/abs/2410.00101v1,2024-09-30 18:00:02+00:00
13,Just another conditionally-solvable non-relativistic quantum-mechanical model,2410.00138,http://arxiv.org/abs/2410.00138v1,2024-09-30 18:19:32+00:00
14,Smallest quantum codes for amplitude damping noise,2410.00155,http://arxiv.org/abs/2410.00155v1,2024-09-30 18:55:09+00:00
15,More buck-per-shot: Why learning trumps mitigation in noisy quantum sensing,2410.00197,http://arxiv.org/abs/2410.00197v1,2024-09-30 19:51:41+00:00
16,Interfering-or-not-interfering quantum key distribution with advantage distillation,2410.00205,http://arxiv.org/abs/2410.00205v1,2024-09-30 20:07:35+00:00
17,Spectra and transport of probability and energy densities in a $\mathcal{PT}$-symmetric square well with a delta-function potential,2410.00234,http://arxiv.org/abs/2410.00234v1,2024-09-30 21:02:34+00:00
18,Criticality-Enhanced Quantum Sensing with a Parametric Superconducting Resonator,2409.19968,http://arxiv.org/abs/2409.19968v1,2024-09-30 05:43:08+00:00
19,Bug-locating Method based on Statistical Testing for Quantum Programs,2409.20011,http://arxiv.org/abs/2409.20011v1,2024-09-30 07:14:08+00:00
20,A Quantum Unique Games Conjecture,2409.20028,http://arxiv.org/abs/2409.20028v1,2024-09-30 07:34:41+00:00
21,Building and aligning a 10-plane light converter,2409.20039,http://arxiv.org/abs/2409.20039v1,2024-09-30 07:44:17+00:00
22,Local equivalence of stabilizer states: a graphical characterisation,2409.20183,http://arxiv.org/abs/2409.20183v1,2024-09-30 10:51:15+00:00
23,Assessing small accelerations using a bosonic Josephson junction,2409.20203,http://arxiv.org/abs/2409.20203v1,2024-09-30 11:33:05+00:00
24,Teleportation fidelity of quantum repeater networks,2409.20304,http://arxiv.org/abs/2409.20304v1,2024-09-30 14:02:58+00:00
25,Experimental Online Quantum Dots Charge Autotuning Using Neural Network,2409.20320,http://arxiv.org/abs/2409.20320v1,2024-09-30 14:22:47+00:00
26,Satellite image classification with neural quantum kernels,2409.20356,http://arxiv.org/abs/2409.20356v1,2024-09-30 14:52:00+00:00
27,Detecting Acoherence in Radiation Fields,2409.20378,http://arxiv.org/abs/2409.20378v1,2024-09-30 15:11:32+00:00
28,Negative thermodynamic pressure: no-go theorem and yes-go examples,2409.20454,http://arxiv.org/abs/2409.20454v1,2024-09-30 16:13:00+00:00
29,Single-atom dissipation and dephasing in Dicke and Tavis-Cummings quantum batteries,2409.20475,http://arxiv.org/abs/2409.20475v1,2024-09-30 16:35:55+00:00
30,Quantum Annealing with chaotic driver Hamiltonians,2409.20538,http://arxiv.org/abs/2409.20538v1,2024-09-30 17:39:54+00:00
31,Cooling and Squeezing a Microwave Cavity State with Magnons Using a Beam Splitter Interaction,2410.00160,http://arxiv.org/abs/2410.00160v1,2024-09-30 19:07:18+00:00
32,High-efficiency quantum Monte Carlo algorithm for extracting entanglement entropy in interacting fermion systems,2409.20009,http://arxiv.org/abs/2409.20009v1,2024-09-30 07:07:51+00:00
33,Non-Abelian Thouless pumping in a Rice-Mele ladder,2409.20136,http://arxiv.org/abs/2409.20136v1,2024-09-30 09:39:06+00:00
34,Quantum Fast Implementation of Private Information Retrieval and Functional Bootstrapping,2409.20182,http://arxiv.org/abs/2409.20182v1,2024-09-30 10:49:18+00:00
35,Phase-Space methods for neutrino oscillations: extension to multi-beams,2409.20215,http://arxiv.org/abs/2409.20215v2,2024-09-30 11:50:44+00:00
36,Measuring Coherent Radio and Microwave Photons from the Solar Corona,2409.20459,http://arxiv.org/abs/2409.20459v1,2024-09-30 16:17:08+00:00
37,"Self-distributive structures, braces & the Yang-Baxter equation",2409.20479,http://arxiv.org/abs/2409.20479v1,2024-09-30 16:40:41+00:00
38,"Element-specific, non-destructive profiling of layered heterostructures",2410.00241,http://arxiv.org/abs/2410.00241v2,2024-09-30 21:21:58+00:00
39,A Quantum-Resistant Photonic Hash Function,2409.19932,http://arxiv.org/abs/2409.19932v1,2024-09-30 04:19:26+00:00
40,Floquet evolution of the q-deformed \texorpdfstring{SU(3)${}_1$}{SU(3)1} Yang-Mills theory on a two-leg ladder,2409.20263,http://arxiv.org/abs/2409.20263v1,2024-09-30 13:02:53+00:00
41,"Quantum amplification, relic gravitons and Landauer's conjecture",2409.20417,http://arxiv.org/abs/2409.20417v1,2024-09-30 15:42:08+00:00
